UNIT_NAME,UNIT_TYPE,PARKNAME
American Memorial Park,Park,American Memorial Park
Ebey's Landing National Historical Reserve,National Historical Reserve,Ebey's Landing
Lake Roosevelt National Recreation Area,National Recreation Area,Lake Roosevelt
Lewis and Clark National Historical Park,National Historical Park,Lewis and Clark
Olympic National Park,National Park,Olympic
Santa Monica Mountains National Recreation Area,National Recreation Area,Santa Monica Mountains
Tule Springs Fossil Beds National Monument,National Monument,Tule Springs Fossil Beds
Acadia National Park,National Park, 
Ala Kahakai National Historic Trail,National Historic Trail, 
Amistad National Recreation Area,National Recreation Area, 
Appalachian National Scenic Trail,National Scenic Trail, 
Assateague Island National Seashore,National Seashore, 
Big Cypress National Preserve,National Preserve, 
Big South Fork National River and Recreation Area,National River and Recreation Area, 
Blue Ridge Parkway,Parkway, 
Bluestone National Scenic River,National Scenic River, 
Cape Hatteras National Seashore,National Seashore, 
Cape Lookout National Seashore,National Seashore, 
Chattahoochee River National Recreation Area,National Recreation Area, 
Chickamauga and Chattanooga National Military Park,National Military Park, 
Chesapeake and Ohio Canal National Historical Park,National Historical Park, 
Cumberland Island National Seashore,National Seashore, 
Everglades National Park,National Park, 
Fire Island National Seashore,National Seashore, 
Fort Raleigh National Historic Site,National Historic Site, 
Gauley River National Recreation Area,National Recreation Area, 
Great Smoky Mountains National Park,National Park, 
Independence National Historical Park,National Historical Park, 
Isle Royale National Park,National Park, 
Lake Meredith National Recreation Area,National Recreation Area, 
Lowell National Historical Park,National Historical Park, 
Mississippi National River and Recreation Area,National River and Recreation Area, 
Nez Perce National Historical Park,National Historical Park, 
New River Gorge National River,National River, 
Obed Wild and Scenic River,Wild and Scenic River, 
Poverty Point National Monument,National Monument, 
Redwood National Park,National Park, 
Rio Grande Wild and Scenic River,Wild and Scenic River, 
San Juan National Historic Site,National Historic Site, 
Shenandoah National Park,National Park, 
Shiloh National Battlefield,National Battlefield, 
Sleeping Bear Dunes National Lakeshore,National Lakeshore, 
Steamtown National Historic Site,National Historic Site, 
Stones River National Battlefield,National Battlefield, 
Timucuan Ecological and Historic Preserve,Ecological and Historic Preserve, 
Vicksburg National Military Park,National Military Park, 
Cedar Creek and Belle Grove National Historical Park,National Historical Park,Cedar Creek & Belle Grove
Little Bighorn Battlefield National Monument,National Monument,Little Bighorn Battlefield
Capulin Volcano National Monument,National Monument,Capulin Volcano
Fort Bowie National Historic Site,National Historic Site,Fort Bowie
Gila Cliff Dwellings National Monument,National Monument,Gila Cliff Dwellings
Manassas National Battlefield Park,National Battlefield Park,Manassas
Tumacacori National Historical Park,National Historical Park,Tumacácori
Tuzigoot National Monument,National Monument,Tuzigoot
Yucca House National Monument,National Monument,Yucca House
Wolf Trap National Park for the Performing Arts,National Park,Wolf Trap NP for the Performing Arts
Monocacy National Battlefield,National Battlefield,Monocacy
Antietam National Battlefield,National Battlefield,Antietam
Castillo de San Marcos National Monument,National Monument,Castillo de San Marcos
Timpanogos Cave National Monument,National Monument,Timpanogos Cave
Theodore Roosevelt Island National Memorial,National Memorial,Theodore Roosevelt Island
Lyndon Baines Johnson Memorial Grove on the Potomac,National Memorial,Lyndon Baines Johnson Memorial Grove
"Arlington House, The Robert E. Lee Memorial",National Memorial,"Arlington House, The Robert E. Lee Memorial"
Cumberland Gap National Historical Park,National Historical Park,Cumberland Gap
Wupatki National Monument,National Monument,Wupatki
Greenbelt Park,Other Designation,Greenbelt
Tupelo National Battlefield,National Battlefield,Tupelo
Brices Cross Roads National Battlefield Site,National Battlefield Site,Brices Cross Roads
Point Reyes National Seashore,National Seashore,Point Reyes
Fort Sumter National Monument,National Monument,Fort Sumter
Florissant Fossil Beds National Monument,National Monument,Florissant Fossil Beds
Tonto National Monument,National Monument,Tonto
Home of Franklin D. Roosevelt National Historic Site,National Historic Site,Home of Franklin D Roosevelt
Ninety Six National Historic Site,National Historic Site,Ninety Six
Charles Pinckney National Historic Site,National Historic Site,Charles Pinckney
Buck Island Reef National Monument,National Monument,Buck Island Reef
Carter G. Woodson National Historic Site,National Historic Site,Carter G. Woodson Home
Cedar Breaks National Monument,National Monument,Cedar Breaks
Padre Island National Seashore,National Seashore,Padre Island
Arches National Park,National Park,Arches
Boston Harbor Islands National Recreation Area,National Recreation Area,Boston Harbor Islands
Sunset Crater Volcano National Monument,National Monument,Sunset Crater Volcano
Mary McLeod Bethune Council House National Historic Site,National Historic Site,Mary McLeod Bethune Council House
Ford's Theatre National Historic Site,National Historic Site,Ford's Theatre
Brown v. Board of Education National Historic Site,National Historic Site,Brown V Board Of Education
Pipe Spring National Monument,National Monument,Pipe Spring
El Morro National Monument,National Monument,El Morro
Chickasaw National Recreation Area,National Recreation Area,Chickasaw
Andrew Johnson National Historic Site,National Historic Site,Andrew Johnson
Saint Paul's Church National Historic Site,National Historic Site,Saint Paul's Church
Castle Clinton National Monument,National Monument,Castle Clinton
Fossil Butte National Monument,National Monument,Fossil Butte
Effigy Mounds National Monument,National Monument,Effigy Mounds
Ice Age National Scenic Trail,National Scenic Trail,Ice Age
Hovenweep National Monument,National Monument,Hovenweep
Fort Union National Monument,National Monument,Fort Union
Abraham Lincoln Birthplace National Historical Park,National Historical Park,Abraham Lincoln Birthplace
Dry Tortugas National Park,National Park,Dry Tortugas
Fort Frederica National Monument,National Monument,Fort Frederica
Piscataway Park,Other Designation,Piscataway
Manzanar National Historic Site,National Historic Site,Manzanar
Bryce Canyon National Park,National Park,Bryce Canyon
"John D. Rockefeller, Jr., Memorial Parkway",National Parkway,John D Rockefeller Jr
George Washington Carver National Monument,National Monument,George Washington Carver
Thomas Edison National Historical Park,National Historical Park,Thomas Edison
Yellowstone National Park,National Park,Yellowstone
Hubbell Trading Post National Historic Site,National Historic Site,Hubbell Trading Post
Chamizal National Memorial,National Memorial,Chamizal
Hawai'i Volcanoes National Park,National Park,Hawaii Volcanoes
Alibates Flint Quarries National Monument,National Monument,Alibates Flint Quarries
Pu'ukohola Heiau National Historic Site,National Historic Site,Puukohola Heiau
Ulysses S. Grant National Historic Site,National Historic Site,Ulysses S Grant
Canaveral National Seashore,National Seashore,Canaveral
African Burial Ground National Monument,National Monument,African Burial Ground
Cabrillo National Monument,National Monument,Cabrillo
Valley Forge National Historical Park,National Historical Park,Valley Forge
George Washington Memorial Parkway,National Parkway,George Washington
Clara Barton National Historic Site,National Historic Site,Clara Barton
Fort Washington Park,Other Designation,Fort Washington
Sequoia National Park,National Park,Sequoia
Kalaupapa National Historical Park,National Historical Park,Kalaupapa
Tuskegee Airmen National Historic Site,National Historic Site,Tuskegee Airmen
Salt River Bay National Historical Park and Ecological Preserve,National Historical Park,Salt River Bay
Natchez National Historical Park,National Historical Park,Natchez
Edgar Allan Poe National Historic Site,National Historic Site,Edgar Allan Poe
Boston African American National Historic Site,National Historic Site,Boston African American
Mammoth Cave National Park,National Park,Mammoth Cave
Grand Teton National Park,National Park,Grand Teton
Eugene O'Neill National Historic Site,National Historic Site,Eugene O'Neill
Adams National Historical Park,National Historical Park,Adams
Navajo National Monument,National Monument,Navajo
Thomas Stone National Historic Site,National Historic Site,Thomas Stone
Cane River Creole National Historical Park,National Historical Park,Cane River Creole
Mesa Verde National Park,National Park,Mesa Verde
Great Basin National Park,National Park,Great Basin
Grand Portage National Monument,National Monument,Grand Portage
Whiskeytown-Shasta-Trinity National Recreation Area,National Recreation Area,Whiskeytown
Fort Point National Historic Site,National Historic Site,Fort Point
Salem Maritime National Historic Site,National Historic Site,Salem Maritime
Washington Monument,National Memorial,Washington Monument
Thomas Jefferson Memorial,National Memorial,Thomas Jefferson Memorial
Moores Creek National Battlefield,National Battlefield,Moores Creek
Horseshoe Bend National Military Park,National Military Park,Horseshoe Bend
Fort Matanzas National Monument,National Monument,Fort Matanzas
Channel Islands National Park,National Park,Channel Islands
Canyonlands National Park,National Park,Canyonlands
Little Rock Central High School National Historic Site,National Historic Site,Little Rock Central High School
White House,Other Designation,President's Park (White House)
Booker T. Washington National Monument,National Monument,Booker T Washington
Jean Lafitte National Historical Park and Preserve,National Historical Park and Preserve,Jean Lafitte
Jewel Cave National Monument,National Monument,Jewel Cave
Fort Larned National Historic Site,National Historic Site,Fort Larned
Kaloko-Honokohau National Historical Park,National Historical Park,Kaloko-Honokohau
Rosie the Riveter/World War II Home Front National Historical Park,National Historical Park,Rosie the Riveter WWII Home Front
Fort Stanwix National Monument,National Monument,Fort Stanwix
Thaddeus Kosciuszko National Memorial,National Memorial,Thaddeus Kosciuszko
William Howard Taft National Historic Site,National Historic Site,William Howard Taft
Fort Scott National Historic Site,National Historic Site,Fort Scott
Perry's Victory and International Peace Memorial,National Memorial,Perry's Victory & International Peace
James A. Garfield National Historic Site,National Historic Site,James A Garfield
Catoctin Mountain Park,Other Designation,Catoctin Mountain
Rainbow Bridge National Monument,National Monument,Rainbow Bridge
Natural Bridges National Monument,National Monument,Natural Bridges
Bent's Old Fort National Historic Site,National Historic Site,Bent's Old Fort
Hohokam Pima National Monument,National Monument,Hohokam Pima
Gulf Islands National Seashore,National Seashore,Gulf Islands
Walnut Canyon National Monument,National Monument,Walnut Canyon
Appomattox Court House National Historical Park,National Historical Park,Appomattox Court House
Pipestone National Monument,National Monument,Pipestone
World War II Valor in the Pacific National Monument,National Monument,World War II Valor in the Pacific
Biscayne National Park,National Park,Biscayne
Minute Man National Historical Park,National Historical Park,Minute Man
Arkansas Post National Memorial,National Memorial,Arkansas Post
Mount Rushmore National Memorial,National Memorial,Mount Rushmore
Guadalupe Mountains National Park,National Park,Guadalupe Mountains
City of Rocks National Reserve,National Reserve,City of Rocks
Hagerman Fossil Beds National Monument,National Monument,Hagerman Fossil Beds
John Muir National Historic Site,National Historic Site,John Muir
Petersburg National Battlefield,National Battlefield,Petersburg
President William Jefferson Clinton Birthplace Home National Historic Site,National Historic Site,President William Jefferson Clinton Birthplace Home
Fort Vancouver National Historic Site,National Historic Site,Fort Vancouver
Saint-Gaudens National Historic Site,National Historic Site,Saint-Gaudens
John Fitzgerald Kennedy National Historic Site,National Historic Site,John F Kennedy
Jefferson National Expansion Memorial,National Memorial,Jefferson
Fort Pulaski National Monument,National Monument,Fort Pulaski
Eleanor Roosevelt National Historic Site,National Historic Site,Eleanor Roosevelt
Friendship Hill National Historic Site,National Historic Site,Friendship Hill
Theodore Roosevelt Birthplace National Historic Site,National Historic Site,Theodore Roosevelt Birthplace
Coronado National Memorial,National Memorial,Coronado
Wright Brothers National Memorial,National Memorial,Wright Brothers
Selma to Montgomery National Historic Trail,National Historic Trail,Selma to Montgomery
Kings Mountain National Military Park,National Military Park,Kings Mountain
Golden Spike National Historic Site,National Historic Site,Golden Spike
New Bedford Whaling National Historical Park,National Historical Park,New Bedford Whaling
Sagamore Hill National Historic Site,National Historic Site,Sagamore Hill
Lava Beds National Monument,National Monument,Lava Beds
Women's Rights National Historical Park,National Historical Park,Women's Rights
George Rogers Clark National Historical Park,National Historical Park,George Rogers Clark
Longfellow House-Washington's Headquarters National Historic Site,National Historic Site,Longfellow
Hopewell Furnace National Historic Site,National Historic Site,Hopewell Furnace
Franklin Delano Roosevelt Memorial,National Memorial,Franklin Delano Roosevelt
Montezuma Castle National Monument,National Monument,Montezuma Castle
Kings Canyon National Park,National Park,Kings Canyon
Springfield Armory National Historic Site,National Historic Site,Springfield Armory
Whitman Mission National Historic Site,National Historic Site,Whitman Mission
World War II Memorial,National Memorial,World War II Memorial
Vietnam Veterans Memorial,National Memorial,Vietnam Veterans
Korean War Veterans Memorial,National Memorial,Korean War Veterans
Constitution Gardens,Other Designation,Constitution Gardens
"Martin Luther King, Jr., Memorial",Other Designation,Martin Luther King Jr
Lincoln Memorial,National Memorial,Lincoln
National Mall,Other Designation,National Mall
Russell Cave National Monument,National Monument,Russell Cave
Maggie L. Walker National Historic Site,National Historic Site,Maggie L. Walker
Fort Davis National Historic Site,National Historic Site,Fort Davis
Bighorn Canyon National Recreation Area,National Recreation Area,Bighorn Canyon
Pu'uhonua o Honaunau National Historical Park,National Historical Park,Pu`uhonua O Honaunau
Nicodemus National Historic Site,National Historic Site,Nicodemus
Muir Woods National Monument,National Monument,Muir Woods
Harry S Truman National Historic Site,National Historic Site,Harry S Truman
Sand Creek Massacre National Historic Site,National Historic Site,Sand Creek Massacre
Knife River Indian Villages National Historic Site,National Historic Site,Knife River Indian Villages
Morristown National Historical Park,National Historical Park,Morristown
Herbert Hoover National Historic Site,National Historic Site,Herbert Hoover
Martin Van Buren National Historic Site,National Historic Site,Martin Van Buren
Governors Island National Monument,National Monument,Governors Island
Scotts Bluff National Monument,National Monument,Scotts Bluff
Johnstown Flood National Memorial,National Memorial,Johnstown Flood
Washita Battlefield National Historic Site,National Historic Site,Washita Battlefield
Agate Fossil Beds National Monument,National Monument,Agate Fossil Beds
Ronald Reagan Boyhood Home National Historic Site,National Historic Site,Ronald Reagan Boyhood Home
Capitol Reef National Park,National Park,Capitol Reef
Flight 93 National Memorial,National Memorial,Flight 93
Devils Postpile National Monument,National Monument,Devils Postpile
San Francisco Maritime National Historical Park,National Historical Park,San Francisco Maritime
Palo Alto Battlefield National Historical Park,National Historical Park,Palo Alto Battlefield
Joshua Tree National Park,National Park,Joshua Tree
Virgin Islands Coral Reef National Monument,National Monument,Virgin Islands Coral Reef
Marsh-Billings-Rockefeller National Historical Park,National Historical Park,Marsh - Billings - Rockefeller
Little River Canyon National Preserve,National Preserve,Little River Canyon
Charles Young Buffalo Soldiers National Monument,National Monument,Charles Young Buffalo Soldiers
Dayton Aviation Heritage National Historical Park,National Historical Park,Dayton Aviation Heritage
Eisenhower National Historic Site,National Historic Site,Eisenhower
First Ladies National Historic Site,National Historic Site,First Ladies
Petroglyph National Monument,National Monument,Petroglyph
Cesar E. Chavez National Monument,National Monument,César E. Chávez
Fort Necessity National Battlefield,National Battlefield,Fort Necessity
Minuteman Missile National Historic Site,National Historic Site,Minuteman Missile
Salinas Pueblo Missions National Monument,National Monument,Salinas Pueblo Missions
Pinnacles National Park,National Park,Pinnacles
Virgin Islands National Park,National Park,Virgin Islands
Rocky Mountain National Park,National Park,Rocky Mountain
Death Valley National Park,National Park,Death Valley
Fort McHenry National Monument and Historic Shrine,National Monument and Historic Shrine,Fort McHenry
Niobrara National Scenic River,National Scenic River,Niobrara
Grand Canyon National Park,National Park,Grand Canyon
Lake Mead National Recreation Area,National Recreation Area,Lake Mead
Saugus Iron Works National Historic Site,National Historic Site,Saugus Iron Works
Roger Williams National Memorial,National Memorial,Roger Williams
Casa Grande Ruins National Monument,National Monument,Casa Grande Ruins
Kennesaw Mountain National Battlefield Park,National Battlefield Park,Kennesaw Mountain
Christiansted National Historic Site,National Historic Site,Christiansted
Allegheny Portage Railroad National Historic Site,National Historic Site,Allegheny Portage Railroad
De Soto National Memorial,National Memorial,De Soto
Andersonville National Historic Site,National Historic Site,Andersonville
Ocmulgee National Monument,National Monument,Ocmulgee
Cowpens National Battlefield,National Battlefield,Cowpens
Chiricahua National Monument,National Monument,Chiricahua
"Martin Luther King, Jr., National Historic Site",National Historic Site,Martin Luther King Jr.
Gettysburg National Military Park,National Military Park,Gettysburg
War in the Pacific,National Historical Park,War in the Pacific
Devils Tower National Monument,National Monument,Devils Tower
Boston National Historical Park,National Historical Park,Boston
Oregon Caves National Monument and Preserve,National Monument,Oregon Caves
General Grant National Memorial,National Memorial,General Grant
River Raisin National Battlefield Park,National Battlefield Park,River Raisin
Golden Gate National Recreation Area,National Recreation Area,Golden Gate
Port Chicago Naval Magazine National Memorial,National Memorial,Port Chicago Naval Magazine
National Capital Parks,Park,National Capital Parks
John Day Fossil Beds National Monument,National Monument,John Day Fossil Beds
First State National Historical Park,National Historical Park,First State
Guilford Courthouse National Military Park,National Military Park,Guilford Courthouse
Paterson Great Falls National Historical Park,National Historical Park,Paterson Great Falls
Pea Ridge National Military Park,National Military Park,Pea Ridge
Weir Farm National Historic Site,National Historic Site,Weir Farm
Theodore Roosevelt Inaugural National Historic Site,National Historic Site,Theodore Roosevelt Inaugural
Lassen Volcanic National Park,National Park,Lassen Volcanic
Badlands National Park,National Park,Badlands
Honouliuli National Monument,National Monument,Honouliuli
Fort Donelson National Battlefield,National Battlefield,Fort Donelson
Vanderbilt Mansion National Historic Site,National Historic Site,Vanderbilt Mansion
Jimmy Carter National Historic Site,National Historic Site,Jimmy Carter
San Juan Island National Historical Park,National Historical Park,San Juan Island
Gateway National Recreation Area,National Recreation Area,Gateway
Upper Delaware Scenic and Recreational River,Scenic and Recreational River,Upper Delaware
Fort Union Trading Post National Historic Site,National Historic Site,Fort Union Trading Post
Minidoka National Historic Site,National Historic Site,Minidoka
Big Hole National Battlefield,National Battlefield,Big Hole
Canyon de Chelly National Monument,National Monument,Canyon de Chelly
Cape Cod National Seashore,National Seashore,Cape Cod
Saratoga National Historical Park,National Historical Park,Saratoga
Manhattan Project National Historical Park,National Historical Park,Manhattan Project
Mount Rainier National Park,National Park,Mount Rainier
Lincoln Boyhood National Memorial,National Memorial,Lincoln Boyhood
Frederick Law Olmsted National Historic Site,National Historic Site,Frederick Law Olmsted
Castle Mountains National Monument,National Monument,Castle Mountain
George Washington Birthplace National Monument,National Monument,George Washington Birthplace
Hamilton Grange National Memorial,National Memorial,Hamilton Grange
Hampton National Historic Site,National Historic Site,Hampton
Waco Mammoth National Monument,National Monument,Waco Mammoth
Glen Canyon National Recreation Area,National Recreation Area,Glen Canyon
Yosemite National Park,National Park,Yosemite
Tallgrass Prairie National Preserve,National Preserve,Tallgrass Prairie
Tuskegee Institute National Historic Site,National Historic Site,Tuskegee Institute
Fort Caroline National Memorial,National Memorial,Fort Caroline
Saint Croix Island International Historic Site,International Historic Site,Saint Croix Island
Fort Laramie National Historic Site,National Historic Site,Fort Laramie
Lower Saint Croix National Scenic Riverway,National Scenic Riverway,Lower Saint Croix
Prince William Forest Park,Park,Prince William Forest
Statue Of Liberty National Monument,National Monument,Statue Of Liberty
Bandelier National Monument,National Monument,Bandelier
Valles Caldera National Preserve,National Preserve,Valles Caldera
Wind Cave National Park,National Park,Wind Cave
Natchez Trace Parkway,Parkway,Natchez Trace
Colorado National Monument,National Monument,Colorado
Fredericksburg and Spotsylvania County Battlefields Memorial National Military Park,National Military Park,Fredericksburg & Spotsylvania
Colonial National Historical Park,National Historical Park,Colonial
Alagnak Wild River,Wild River,Alagnak
Aniakchak National Monument,National Monument,Aniakchak
Aniakchak National Preserve,National Preserve,Aniakchak
Bering Land Bridge National Preserve,National Preserve,Bering Land Bridge
Cape Krusenstern National Monument,National Monument,Cape Krusenstern
Denali National Park,National Park,Denali
Denali National Preserve,National Park,Denali
Gates of the Arctic National Park,National Park,Gates of the Arctic
Gates of the Arctic National Preserve,National Preserve,Gates of the Arctic
Glacier Bay National Park,National Park,Glacier Bay
Glacier Bay National Preserve,National Preserve,Glacier Bay
Katmai National Park,National Park,Katmai
Katmai National Preserve,National Preserve,Katmai
Kenai Fjords National Park,National Park,Kenai Fjords
Klondike Gold Rush National Historical Park,National Historical Park,Klondike Gold Rush
Kobuk Valley National Park,National Park,Kobuk Valley
Lake Clark National Park,National Park,Lake Clark
Lake Clark National Preserve,National Preserve,Lake Clark
Noatak National Preserve,National Preserve,Noatak
Sitka National Historical Park,National Historical Park,Sitka
Wrangell-St. Elias National Park,National Park,Wrangell - St Elias
Wrangell-St. Elias National Preserve,National Preserve,Wrangell - St Elias
Yukon-Charley Rivers National Preserve,National Preserve,Yukon - Charley Rivers
Richmond National Battlefield Park,National Battlefield Park,Richmond
Pullman National Monument,National Monument,Pullman
Pennsylvania Avenue National Historic Site,National Historic Site,Pennsylvania Avenue
World War I Memorial,National Memorial,World War I
Belmont-Paul Women's Equality National Monument,National Monument,Belmont-Paul Women's Equality
North Cascades National Park,National Park,North Cascades
Ross Lake National Recreation Area,National Recreation Area,Ross Lake
Stonewall National Monument,National Monument,Stonewall
Fort Monroe National Monument,National Monument,Fort Monroe
National Park of American Samoa,National Park,National Park of American Samoa
Voyageurs National Park,National Park,Voyageurs
Harpers Ferry National Historical Park,National Historical Park,Harpers Ferry
Buffalo National River,National River,Buffalo
Congaree National Park,National Park,Congaree
Homestead National Monument,National Monument,Homestead
Federal Hall National Memorial,National Memorial,Federal Hall
